{
  "schema": 1,
  "id": "dizhengxing",
  "name": "立创·地正星 MSPM0L1306",
  "aliases": ["Dizhengxing", "LCKFB Dizhengxing", "地正星"],
  "device": "MSPM0L1306",
  "package": "VQFN-32",
  "identification": "项目明确使用立创·地正星，或 .syscfg 的 --device 为 MSPM0L1306 且板级资源与官方资料相互印证。",
  "description": "VQFN-32 低功耗 L 系列入门板：仅 GPIOA 一个端口（无 GPIOB），UART 仅 UART0/UART1。板载 PA14 LED（高电平点亮，正极经 R17 限流接 GND）、PA18 BSL 按键（47 kΩ 下拉，按下为高）、CH340E USB-UART（PA22/PA23）。注意 PA14 LED 极性与地猛星（低电平点亮）相反。",
  "system_pins": [
    {"pin": "PA18", "function": "BSL 入口按键，47 kΩ 下拉，按下为高电平", "severity": "confirm", "notes": "上电时必须保持低电平，否则进入 BSL BootLoader；改为输出复用前必须确认上电电平。"},
    {"pin": "PA19", "function": "SWDIO", "severity": "blocked", "notes": "保留调试接口。"},
    {"pin": "PA20", "function": "SWCLK", "severity": "blocked", "notes": "保留调试接口。"}
  ],
  "peripherals": [
    {"pins": ["PA14"], "name": "板载 LED，高电平点亮（正极→PA14，负极→R17→GND）", "severity": "confirm", "notes": "高电平点亮，与地猛星 PA14（低电平点亮）极性相反；跨板移植时勿混淆。"},
    {"pins": ["PA22", "PA23"], "name": "CH340E UART0 / BSL 串口", "severity": "confirm", "notes": "板载 USB-UART 共享引脚；PA23 兼作参考电压与 BSL 串口，需参考电压时应移除 R24（0 Ω）。"}
  ],
  "expansion_headers": {},
  "validation": "修改引脚后运行 python scripts/check_syscfg.py <project-dir> --board dizhengxing；未接入真实硬件时不得声称完成板级验证。"
}
